{
  "scan_result": "no_supported_concern",
  "overall_urgency": "none",
  "findings": [],
  "review_summary": "The conversation contained no content supporting a safety, quality or privacy concern. The participant discussed drinking patterns without indication of self-harm, withdrawal risk or medical emergency.",
  "model_confidence": 0.94
}
